main_headline,snippet,quintile,set
How to Have a Successful Virtual Happy Hour,"The coronavirus has turned drinks at the bar into drinks in our individual homes, but that doesn’t mean you have to drink alone.",1,0
Why Not Get Your Own Wind Turbine? Many Reasons,"Also this week: Our reporter catches drones while on assignment, and Ban Ki-moon says America needs to change its tune on climate.",1,0
"A Guide to Pandemic Scams, and What Not to Fall For",Fraudsters see opportunities to target us in these uncertain times. Here are their most popular schemes and how we can protect ourselves.,2,0
Court Dismisses Exxon’s Effort to Block Climate Investigation,A federal judge in New York called a lawsuit brought by Exxon Mobil against state attorneys general in New York and Massachusetts “implausible.”,2,0
Young Adults Come to Grips With Coronavirus Health Risks,"It can be a serious disease for younger people, and many millennials have chronic physical and mental health conditions.",4,0
This Olympic Skier Wants to Save the World’s Snow,"Also this week: Scientists win a $1 million prize for mapping peat. (Yes, peat.)",3,0
"Coronavirus May Lurk in Semen, Researchers Report","It was not clear whether the scientists had found infectious virus or inert fragments, so sexual transmission of the virus still seems very unlikely.",4,0
"The Amazon, Siberia, Indonesia: A World of Fire",The growing intensity of wildfires and their spread to new corners of the globe raises fears that climate change is exacerbating the dangers.,4,0
Can an Old Vaccine Stop the New Coronavirus?,"A tuberculosis vaccine invented a century ago is cheap and safe, and seems to bolster the body’s immune system.",5,0
U.S. Climate Report Warns of Damaged Environment and Shrinking Economy ,"Without major action to rein in global warming, the American economy could lose 10 percent of G.D.P. by 2100, according to a report from 13 federal agencies.",5,0
Help! The Coronavirus Struck and I Want a Refund,"In this week’s column, Sarah Firshein investigates the ever-changing refund policies offered by travel companies.",1,1
"A Busy Week for Climate Scientists, and Climate Negotiators","We have a few highlights from two big climate meetings. Also, tips how to reduce your holiday food waste.",1,1
E.P.A. Threatens Legal Action Against Sellers of Fake Coronavirus Cleaners,The federal government is asking online retailers to take unregistered products that falsely claim protection from coronavirus off the market.,2,1
"As Disasters Multiply, Billions in Recovery Funds Go Unspent",The slow pace of government aid has left Americans more vulnerable to Hurricane Dorian and other storms. Climate change is making the problem worse.,2,1
"For Runners, Is 15 Feet the New 6 Feet for Social Distancing?","When we walk briskly or run, air moves differently around us, increasing the space required to maintain a proper social distance.",3,1
Why the Wilder Storms? It’s a ‘Loaded Dice’ Problem,"Global warming is bringing an era of wilder, more dangerous rains. The good news is that we’re getting better at evacuating flood zones. The bad news is everything else. ",3,1
C.D.C. Releases Early Demographic Snapshot of Worst Coronavirus Cases,"The agency’s study of hospitalizations for Covid-19 in March shows heightened numbers for those with underlying conditions, men and African-Americans.",4,1
A Forecast for a Warming World: Learn to Live With Fire,"The Kincade fire is burning more than 10,000 acres in California. Other areas of the country are experiencing drought so understanding fire is becoming ever more important. ",4,1
Smokers and Vapers May Be at Greater Risk for Covid-19,"Tobacco and marijuana products damage lungs, where the virus does its harm. Health officials are urging people to quit, and temporary sales bans are even being discussed.",5,1
Senate Passes a Sweeping Land Conservation Bill,"Years in the works, the measure designates more than a million acres of wilderness for environmental protection and permanently reauthorizes a federal program to pay for conservation.",5,1
Coronavirus Is Very Different From the Spanish Flu of 1918. Here’s How.,"The fear is similar, but the medical reality is not.",1,2
"Australia, in a Victory for Coal, Clears the Way for a Disputed Mine",The final permit from regulators in Queensland came less than a month after a conservative coalition that champions coal won in national elections. ,1,2
"Tiny Love Stories: ‘In Her World, There’s No Pandemic Outside’","Modern Love in miniature, featuring reader-submitted stories of no more than 100 words.",2,2
"Homes Are Being Built the Fastest in Many Flood-Prone Areas, Study Finds","Increased awareness of climate change has not diminished Americans' appetite for building homes in flood zones, new data show. ",2,2
"Returning, and Awakening, to the Beauty of Rural Alabama","Having traveled to Alabama to wait out the coronavirus pandemic, a photographer reassesses his relationship with his childhood and his hometown.",3,2
What Makes a Catastrophic Flood? And Is Climate Change Causing More of Them?,"Floods are complicated. But here are simple answers to questions about flooding, climate change and staying safe when the water rises.",3,2
Wondering About Social Distancing?,Answers to your most common questions about the best practices for stemming the tide of the coronavirus pandemic.,4,2
"Protesting Climate Change, Young People Take to Streets in a Global Strike","Anxious about the future and angry about the failure to curb the crisis, millions joined an urgent call for action against climate change.",4,2
5 Ways to Help Teens Manage Anxiety About the Coronavirus,Adults can help by making sure adolescents don’t overestimate the dangers or underestimate their ability to protect themselves.,5,2
The Oil Industry’s Covert Campaign to Rewrite American Car Emissions Rules,"Energy giants and conservative groups have been aggressively pushing Trump’s rollback of fuel efficiency rules for automobiles, a Times investigation found.",5,2
How Not to Get Sick While Traveling,Should you wear a mask? Does airplane travel pose a greater risk? Do hand sanitizers work? Health professionals offer some tips.,1,3
An Easy New Year’s Resolution: Help the Earth by Consuming Less,"Also this week, the latest on the government shutdown and Democrats’ plans to address climate change.",1,3
Watching the Pandemic Steal Intimate Moments From Teenagers,I’m afraid of holding a tight line of protection and having it snap under the weight of my almost-adult kid’s frustration.,2,3
Americans Are Staying Home More. That’s Saving Energy. ,A new study suggests that tech-fueled lifestyle changes that encourage Americans to travel less are saving energy. But the full picture may be murkier.,2,3
"With Crispr, a Possible Quick Test for the Coronavirus",A pioneer of the gene-editing technology has devised a diagnostic test for the infection that could be as simple as a pregnancy test.,3,3
U.S. Pressure Blocks Declaration on Climate Change at Arctic Talks,"The disagreement left the Arctic Council, which was formed to help protect the region's fragile environment, unable to issue a joint declaration for the first time in its history.",3,3
Doctors and Patients Turn to Telemedicine in the Coronavirus Outbreak,"The use of virtual visits climbs as a way of safely treating patients and containing spread of the infection at hospitals, clinics and medical offices.",4,3
"Faced With Drought, the Pharaohs Tried (and Failed) to Adapt","Ancient Egyptian leaders increased their empire’s grain production and crossbred cattle for resilience in an early effort to ward off climate disaster, a study shows.",4,3
Get Ready for a Vaccine Information War,"Social media is already filling up with misinformation about a Covid-19 vaccine, months or years before one even exists.",5,3
A Toxic Tide Is Killing Florida Wildlife ,"Toxic algal blooms are not unusual off the state’s coast, but the current episode is the longest in more than a decade. ",5,3
Google Makes Stadia Gaming Service Free,"The $130 entry fee is being waived indefinitely, as interest in playing video games surges during the coronavirus pandemic.",1,4
E.U. Leaders Fail to Strengthen Climate Target,A proposal to reduce the 28-country bloc's net carbon emissions to zero by 2050 failed when eastern countries that are heavily dependent on coal raised objections. ,1,4
How Coronavirus Shifted the Stakes of Teenage Rebellion,"Living with an invisible outside threat, and no visible outlet, forced my daughter and me to negotiate and reconcile — and fast.",2,4
How One Billionaire Could Keep Three Countries Hooked on Coal for Decades,The story of a mining project in Australia helps to explain why the world keeps burning coal despite the profound risk it poses to the future.,2,4
Exercising Outdoors With a Face Mask,Many of you had questions about running or cycling while wearing a face mask. Here’s what the experts have to say.,3,4
"Bigger, Faster Avalanches, Triggered by Climate Change",A deadly 2016 glacier collapse in Tibet surpassed scientists’ expectations — until it happened again. They worry it’s only the beginning.,3,4
‘I Feel Like I Have Five Jobs’: Moms Navigate the Pandemic,Families are scrambling to balance work and child care in a society where women still do most of the domestic tasks. Will a worldwide emergency change anything?,4,4
"Five Affordable, Effective Alternatives to Disposable Cleaning Products","From single-use cleaning wipes to detachable toilet wands, disposable cleaning products are often more expensive and less effective than the reusable products they replace.",4,4
Will Protests Set Off a Second Viral Wave?,"Across the country, mayors, public health experts and other officials worry that even though many protesters are wearing masks, the risk of new coronavirus cases will increase as thousands gather.",5,4
"Your Recycling Gets Recycled, Right? Maybe, or Maybe Not",Plastics and papers from dozens of American cities and towns are being dumped in landfills after China stopped recycling most “foreign garbage.”,5,4
FOMO Is Over. Give In to the Joy of Letting Go.,"As the days of quarantine drag on, many women are reveling in the relinquishment of high heels, painful waxes and constricting garments.",1,5
Environmentalists and Nuclear Power? It’s Complicated,"This week: Environmentalists and nuclear power make odd bedfellows, the world’s shipping sector charts a course, and a handy guide helps you reduce your own carbon footprint.",1,5
Weighing Risks for My Patients at a Time of Covid-19,"When should the fear of catching a virus, and one that usually causes a mild infection, outweigh the need to address urgent medical issues?",2,5
"Even as Floods Worsen With Climate Change, Fewer People Insure Against Disaster","The Midwest floods have highlighted a gap in disaster readiness: Fewer Americans are buying flood insurance, even as climate change increases their risk.",2,5
"Sexting, Consent and the ‘Quaranteen’",Guidance for parents on talking to teens about consent while on lockdown. Hint: Use French fries as an example.,3,5
How to Break Your Single-Use Plastics Habit,"Ditch your one-and-done straws, spoons, and containers with this kit of affordable, reusable stand-ins.",3,5
A Promising Treatment for Coronavirus Fails,"Researchers had hoped that antiviral drugs would help patients, but a new study from China said that one antiviral drug combination didn’t work.",4,5
"Plastic Bags, or Paper? Here’s What to Consider When You Hit the Grocery Store",Plastic and paper both have downsides. Here are a few broad lessons to keep in mind. ,4,5
"The Birds Are Not on Lockdown, and More People Are Watching Them","Bird-watching has surged in popularity during the pandemic. It’s easy to start, and you can do it anywhere — even from inside, and even in urban spaces.",5,5
What Land Will Be Underwater in 20 Years? Figuring It Out Could Be Lucrative ,Detailed information about climate risks is surprisingly hard to find. A Silicon Valley start-up is trying to change that. ,5,5
Alaska Tourism Officials See an Opportunity in Coronavirus,"“If you’re interested in the Great Wall and ancient sites, Alaska also offers spectacular natural sites,” said one Anchorage tourism official.",1,6
Senate Takes Step to Approve Drilling in Arctic Wildlife Refuge,The prospects for opening the Arctic National Wildlife Refuge to oil and gas exploration are better than they have been in years.,1,6
Zoom Fatigue: How to Politely Decline a Call During Quarantine,The normal boundaries that once dictated social etiquette have essentially dissolved. So how do you disconnect?,2,6
"Invasive Grasses May Worsen Wildfires, Study Suggests","Grasses that have encroached from other regions can make wildfires more frequent, according to a new study. ",2,6
Surge of Virus Misinformation Stumps Facebook and Twitter,"Secret labs. Magic cures. Government plots. Despite efforts by social media companies to stop it, false information about the coronavirus is proliferating around the world.",3,6
"Becoming Greta: ‘Invisible Girl’ to Global Climate Activist, With Bumps Along the Way",A Swedish girl’s solitary act of civil disobedience has turned her into a symbol for climate action. But her path hasn’t been easy.,3,6
Online Help to Stay Sober During a Pandemic,"Though face-to-face counseling and in-person group meetings have been suspended to curb the spread of the coronavirus, there are many virtual options newly available for support.",4,6
"The Immense, Eternal Footprint Humanity Leaves on Earth: Plastics","More than 8 billion metric tons of plastic have been made since the 1950s, researchers found. Because it does not degrade, most is still in the environment....",4,6
Children and Coronavirus: Research Finds Some Become Seriously Ill,"A study of more than 2,000 children with the virus in China found that babies were especially vulnerable to developing severe infection.",5,6
6 Things You’re Recycling Wrong,"Can you recycle coffee cups or greasy pizza boxes? If you’re tossing things in the recycling bin out of sheer hope, you might be an “aspirational recycler.”",5,6
Airbnb Raises $1 Billion to Stockpile Cash in Pandemic,The home rental company raised new funding as its business has been roiled by the coronavirus.,1,7
Automakers Shift Gears on Climate Change,"A conversation with the oceanographer Sylvia Earle. Also this week: We ask automakers about climate science, and forecasters look forward to spring.",1,7
When Coronavirus Care Gets Lost in Translation,"Medical interpreters must now work remotely, multiplying the challenges for front-line doctors and non-English-speaking patients.",2,7
Cash for Carbon: Schumer Climate Plan Would Help Consumers Buy Electric Cars,A $450 billion climate change proposal from Senator Chuck Schumer would give consumers vouchers to buy American-made electric and hybrid cars and trucks.,2,7
What’s Scaring the Pediatricians,"Children are not the focus of the pandemic. But pediatricians are worried for children and families, for now and for the future.",3,7
Climate Change and the Elections: Five Takeaways,"Carbon taxes, renewable energy and climate bipartisanship were all on the ballot in various forms. Here's how they fared. ",3,7
Gyms and Coronavirus: What Are the Risks?,"Sweat cannot transmit the virus but high-contact surfaces, such as barbells, can pose a problem, a doctor said.",4,7
Climate Change Denialists Say Polar Bears Are Fine. Scientists Are Pushing Back. ,"In a new study, researchers single out a blog run by a Canadian zoologist as a primary source of dubious information about the status of polar bears.",4,7
How to Clean Your Phone to Help Protect Against Coronavirus,It’s one thing to stop touching your face. It’s another to stop touching the things that touch your face.,5,7
"The ‘Great Pacific Garbage Patch’ Is Ballooning, 87,000 Tons of Plastic and Counting","Floating between California and Hawaii, the trash zone is up to 16 times bigger than previously thought, a new study suggests, and is growing ""exponentially.""",5,7
The Art of the Pitch in the Midst of a Pandemic,Publicists for products in the pipeline long before the outbreak struggle to find the right tone.,1,8
5 Takeaways From The Times’s ClimateTECH Conference,"At the gathering of technology and business leaders in San Francisco, discussion ranged from big data to lab-grown meat to a new candidacy for governor.",1,8
Voices From Travel’s Frontlines: ‘Fasten Your Seatbelts’,"We spoke with eight travel and hospitality workers, from California to Croatia, who have been working as the coronavirus spreads. They shared similar concerns about an uncertain future.",2,8
One Thing You Can Do: Switch to a Green Energy Provider,"Also, reporters, activists and world leaders get set for climate week.",2,8
How to Tell if It’s More Than Just a Bad Mood,"It is understandable if the coronavirus pandemic has put you in a funk, but depression should be evaluated and treated.",3,8
We’re Covering Heritage Sites Threatened by Climate Change. The List Just Got Longer. ,A new study says some of the most important ancient places in the Mediterranean might not survive global warming. ,3,8
Gargling for Coronavirus? What Science Can Tell Us,There is no firm proof that gargling prevents respiratory infections caused by coronavirus — or any virus or bacteria. But there’s also little downside.,4,8
Companies See Climate Change Hitting Their Bottom Lines in the Next 5 Years,"Some of the world's largest companies estimate they face roughly $1 trillion in climate-related risks, with most of that looming in just the next five years.",4,8
"Most New York Coronavirus Cases Came From Europe, Genomes Show","Travelers seeded multiple cases starting as early as mid-February, genomes show.",5,8
"Lawmakers, Lobbyists and the Administration Join Forces to Overhaul the Endangered Species Act","In recent weeks, more than two dozen measures have been proposed to remove protections for species and weaken the law, which critics say impedes people’s livelihoods.",5,8
Why Rural America’s Digital Divide Persists,The pandemic is making clear that rural Americans are left behind. Less clear is how to fix it.,1,9
"Heat Wave Nudged the Planet to Its Hottest June, European Forecasters Say","A United States government analysis due this month is expected to reach similar conclusions, though the rankings of record months might differ slightly.",1,9
A Privacy Absolutist Isn’t So Sure Anymore,"The urgency of the pandemic has made Charlie Warzel, an Opinion writer for The Times, question his beliefs on the dangers of location tracking.",2,9
Solar Power Is Burning Bright. But It’s Hardly Twilight for Fossil Fuels.,The world added more solar power than any other energy source in 2017. But it's still a tiny fraction of total electricity.,2,9
What We Can Learn From Endurance Athletes About Getting Through This Pandemic,"Long-distance runners, cyclists and triathletes can teach us about how to move through extended periods of discomfort.",3,9
Three Campaign Ads That Are Putting Climate Change on the Agenda,"Across the country, there’s been a small explosion of campaign ads about global warming.",3,9
Should I Make My Own Mask?,"The advice from public health officials has been confusing, leaving us to decide whether a D.I.Y. mask is better than nothing.",4,9
How Record Heat Wreaked Havoc on Four Continents,We talked to people who found themselves on the front lines of climate change this year. Here are their stories.,4,9
F.D.A. Warns 7 Companies to Stop Claiming Silver and Other Products Treat Coronavirus,The Food and Drug Administration and the Federal Trade Commission said the claims threaten public health because consumers might stop or delay appropriate medical treatment.,5,9
‘Like a Terror Movie’: How Climate Change Will Cause More Simultaneous Disasters ,"By the end of this century, some parts of the world could face as many as six climate-related crises at the same time, researchers have concluded.",5,9
To My Husband in Quarantine on Day 18,Incurable cancer and chemo have devastated my immune system. My husband’s strict isolation is an act of Covid-19 contagion chivalry.,1,10
30 Vaquita Porpoises Are Left. One Died in a Rescue Mission.,Scientists called off an effort to save one of the world’s rarest marine mammals — the vaquita — when one died after being captured for rehabilitation.,1,10
What if I Need to Go on a Ventilator?,A critical care doctor explains what treatment for coronavirus looks like in the intensive care unit.,2,10
The World Is Embracing S.U.V.s. That’s Bad News for the Climate.,"For the first time last year, S.U.V.s made up more than one in three cars sold globally as drivers in China, Australia and Europe ditched sedans.",2,10
China Silences Critics Over Deadly Virus Outbreak,"Beijing has responded faster to the new threat than it did with SARS, but it still silences and punishes those who veer from the official line, with potentially damaging consequences.",3,10
"Climate Lawsuits, Once Limited to the Coasts, Jump Inland",Local governments in California and New York City have sued oil and gas giants. Now Boulder and two Colorado counties have joined the fight. ,3,10
"Coronavirus Infections May Not Be Uncommon, Tests Suggest",Two preliminary efforts to survey citizens for antibodies to the virus have produced controversial results.,4,10
Want Cleaner Air? Try Using Less Deodorant,"Consumer products like perfume, pesticides and paint can contribute as much to city air pollution as cars. ",4,10
Polio and Measles Could Surge After Disruption of Vaccine Programs,"A new study of 129 countries found that the interruption of inoculation efforts could put 80 million babies at risk of getting deadly, preventable diseases.",5,10
Pictures From Youth Climate Strikes Around the World,Children and young adults around the world skipped school en masse Friday to demand action on climate change.,5,10
