"cond","SID","survey_name","item","value","article_number","content","article_cond"
"social","s197","comment","3","If this diet unlikely to provide benefits, i make sure all people in my community should know about it",66,"health","control"
"self","s198","comment","3","This article about the climate change in next 5 years this article makes me feel fearful.",87,"climate","control"
"self","s200","comment","3","Article is about Precaution measures for kidney stone",46,"health","self"
"social","s201","comment","3","The problem is there are so few green energy providers in our state. It's hard to make changes when they're not available. :(",83,"climate","control"
"self","s202","comment","3","All people should do exercise daily",56,"health","control"
"social","s204","comment","3","Motion keeps the brain on its toes as it ages.",14,"health","control"
"social","s205","comment","3","It's possible that a gut bacteria could help make us run faster since that bacteria is higher in mice that ran faster.",72,"health","control"
"social","s206","comment","3","very much useful conference.",81,"climate","control"
"self","s207","comment","3","I am sick and tired of my life being affected by climate changes and these companies need to be held accountable!",3,"climate","self"
"self","s208","comment","3","the highest level of weght associated cancer are in the south,my esidence also in the south side",54,"health","self"
"social","s210","comment","3","A climate change bill that helps Americans buy electric cars.",73,"climate","control"
"self","s211","comment","3","The article indicates that increased consumption of plant proteins may lead to lower rates of cardiovascular death or stroke, thus lengthening life spans",64,"health","control"
"self","s212","comment","3","Opposing to government",102,"health","self"
"social","s214","comment","3","looks like babies can have food sooner than we thought",44,"health","control"
"social","s215","comment","3","I hope this fraction can increase in the next administration!",93,"climate","control"
"social","s216","comment","3","How dancing can be good for your brain.",14,"health","social"
"self","s217","comment","3","It looks like more and more lawsuits are happening with oil and gas companies.",105,"climate","control"
"social","s218","comment","3","It affect many people lives",53,"climate","social"
"self","s219","comment","3","It matters because the environment effects all people and future generations",9,"climate","self"
"social","s222","comment","3","A major scientific report issued by 13 federal agencies on Friday presents the starkest warnings to date of the consequences of climate change for the United States, predicting that if significant steps are not taken to rein in global warming, the damage will knock as much as 10 percent off the size of the American economy by century’s end.",9,"climate","control"
"self","s223","comment","3","This article is about how Parkinson's Disease and Heart Risks are related in a way that some people may not know.",82,"health","control"
"self","s224","comment","3","This matters to me if I decide to use CBD.",88,"health","self"
"social","s227","comment","3","people with really needs much help, hope and money",24,"health","social"
"self","s230","comment","3","Being a dog lover, I have found that having a dog in the bedroom makes me sleep better knowing I have security.  Researchers know what others have known for centuries, its wise to have a dog for protection. You will sleep well.",38,"health","self"
"self","s234","comment","3","This is about using clean energy for your personal home use.",83,"climate","control"
"social","s235","comment","3","It is about knowing the details and making their actions clear",89,"climate","control"
"social","s236","comment","3","this article matters because it includes informations that can help the US save a tun of money which in my opinion can help to put towards helping the less fortunate and building the country.",12,"health","social"
"self","s237","comment","3","PROTEIN HELPS US TO LIVE LONGER",64,"health","self"
"self","s242","comment","3","It deals with the need to increase our need for solar power.",93,"climate","control"
"self","s243","comment","3","Happy to have this helpful info to share with parents-to-be!",60,"health","self"
"social","s246","comment","3","This is about using computers to treat and predict cancer.",104,"health","control"
"self","s248","comment","3","This article very much influencing in my thoughts. Because many of Americans started to make conversation about climate change and its impacts. This article claims that the climate changing creates disaster. Partially it must be true",13,"climate","control"
"social","s249","comment","3","how banning sugary drink had a positive effect on workers",94,"health","control"
"self","s250","comment","3","This article matters to me personally because I offered vitamin D to my wife during her pregnancy.",60,"health","self"
"social","s251","comment","3","This matters to people I know who live on planet earth and don't want climate change to ruin the world we live in.",3,"climate","social"
"social","s255","comment","3","This would just be relevant health information for the people I know to keep in mind. No one I know is obese, though.",54,"health","social"
"social","s257","comment","3","because most of the cleaning products are not effective",47,"climate","social"
"self","s258","comment","3","Activities for active brain.",14,"health","control"
"social","s259","comment","3","It is very necessary article it tells about the necessary of Twilight and energy source",93,"climate","social"
"self","s260","comment","3","Heart monitors can make HIIT fun and exciting to do.",58,"health","control"
"social","s261","comment","3","Feeding babies solid food at 3 months.",44,"health","control"
"self","s262","comment","3","I have been feeling very fit lately as i have intensified my workout about 5% more than the usual.",56,"health","self"
"social","s265","comment","3","A strike against a oil superpower trying to avoid investigation and a win for the environment.",3,"climate","social"
"self","s268","comment","3","I feel that the it is important that a baby can go on solid foods earlier and it would help me out on the formula and save me some money to and they will get healthy foods",44,"health","self"
"social","s270","comment","3","People should ensure their safe and secure by insuring from future disasters",53,"climate","social"
"self","s273","comment","3","the economy and climate change are all making a negative impact on society",9,"climate","control"
"social","s274","comment","3","It is a very interesting news",3,"climate","control"
"social","s275","comment","3","Exercise could help you love longer",56,"health","control"
"self","s276","comment","3","it was about the smoking is not good for health and not smoking gives a healthy and long life.",16,"health","self"
"self","s277","comment","3","solar power is very important to produce electricity",93,"climate","self"
"self","s278","comment","3","This is good to know! I will pass this information along to my female family and friends and hopefully they will be able to reduce their risk for breast cancer.",52,"health","self"
"social","s279","comment","3","This article is about the climate change declaration at Arctic Talks",35,"climate","control"
"self","s280","comment","3","women eating processed meats have a higher chance of breast cancer
",52,"health","control"
"self","s281","comment","3","This article suggests that it matters more what you eat and not how much you eat.  It says you can eat larger portions of healthy foods.",8,"health","control"
"social","s283","comment","3","climate change and global warming isues affect all of us",27,"climate","social"
"self","s287","comment","3","It matters because I am one of those Americans staying home but I'm not saving energy at home.",33,"climate","self"
"self","s288","comment","3","How to prepare for the increase in flooding caused by global warming.",25,"climate","control"
"social","s292","comment","3","The elections have consequences regarding what will be done about climate change and how much it may cost taxpayers.",75,"climate","social"
"social","s294","comment","3","It is good to know what is going on with the climatic change in our community.",71,"climate","control"
"social","s295","comment","3","GMOs and people that oppose them don't know that much about them.",102,"health","control"
"self","s297","comment","3","Most processed foods are harmful to our health.",28,"health","control"
"social","s299","comment","3","Deli meats increase risk of colon cancer.",28,"health","control"
"social","s300","comment","3","advantages and disadvantages of using plastic and paper bags",57,"climate","control"
"self","s301","comment","3","It is important to state healthy.",64,"health","self"
"social","s303","comment","3","Hearing is very important",90,"health","social"
"self","s305","comment","3","Low impact sports for exercise might make bones weaker in old age",98,"health","control"
"social","s307","comment","3","climate change is real",7,"climate","control"
"self","s308","comment","3","It is about high intensity interval training tool.",58,"health","control"
"self","s311","comment","3","Babies who are given solid food at 3 months sleep longer than babies who are exclusively breast-fed through the age of 6 months.",44,"health","control"
"self","s313","comment","3","The possibility of diet and exercise reduce artery plaque.",84,"health","control"
"self","s314","comment","3","As coal-derived energy is a major contributor to global warming, the success of this particular coal mine detracts from my personal goal of combating climate change.",21,"climate","self"
"social","s316","comment","3","The article is a summation of the election results relative to climate change issues.",75,"climate","social"
"self","s318","comment","3","My dad has sleep apnea, and is on a C-PAP at night.",106,"health","self"
"self","s319","comment","3","This article is very motivational",76,"health","self"
"self","s320","comment","3","It is about coal despite the profound risk",43,"climate","control"
"self","s321","comment","3","This article is about skin infections.",80,"health","control"
"social","s322","comment","3","Most people I know are environmentally conscious and this article would provide them with some simple things they can do to cut down on plastic.",55,"climate","social"
"self","s324","comment","3","A zoologist wrote that polar bears are fine, climate scientists disagree.",77,"climate","control"
"social","s326","comment","3","The article declares that the environmental issue which the world defending against it. Every living things in this world they had its own place because of our developments we may cause some indirect damage for our environment this article definitely matters.",15,"climate","social"
"social","s327","comment","3","relate to the ultimate sports fans",45,"climate","social"
"social","s328","comment","3","I know plenty of people that enjoy HIIT training and would like to know more about it.",58,"health","social"
"social","s329","comment","3","This article matters to people I know because both of those issues are key to survival.  The environment is key to the survival of our species and the other is survival economically.",9,"climate","social"
"self","s330","comment","3","It's pointing out we can save food from being wasted if we buy only what we need right away. Good idea, I'd rather have everything fresh.",20,"health","control"
"self","s331","comment","3","Taking supplement is healthier way and increase the nutrition.",72,"health","self"
"social","s335","comment","3","making it known that the supplement is not yet confirmed to work for humans",72,"health","social"
"self","s337","comment","3","I guess that this could push people into higher density living as usable land decreases. I like having a modest amount of space to live in and the reduced traffic from a moderate level of population density.",25,"climate","self"
"social","s338","comment","3","They frequently engage in the use of perfume and paint and they generally care about the environment.",107,"climate","social"
"social","s344","comment","3","Waste managers often call this wishful recycling but it is wrong. Because it can do more harm than good.",69,"climate","social"
"self","s345","comment","3","I have family who take statins for their cholesterol and their health isn't good enough to handle a staph skin infection.",80,"health","self"
"social","s348","comment","3","I hope we do something about climate change soon",97,"climate","social"
"social","s349","comment","3","My parents need to lose some weight so this article might help",56,"health","social"
"social","s352","comment","3","This article matters because it will help to reduce climate change with the aid of recycling",55,"climate","social"
"social","s353","comment","3","This article shows that how hungry is this grandmother.",70,"health","social"
"self","s358","comment","3","Very useful tip to weight loss",0,"health","control"
"self","s360","comment","3","They had some great plan for the future days. In present day leaders should try to learn from the our forefathers and had to apply on the real life.",37,"climate","self"
"social","s361","comment","3","The article concerns the fact that Americans are still building homes in flood-prone areas, despite our increased awareness in climate change concerns.",23,"climate","control"
"social","s363","comment","3","I guess it's relevant to people who like snow ? Or is it environmental statement ? No idea what mapping peat is...
I think it might be regarding climate change ?",5,"climate","social"
"social","s364","comment","3","Some people I know are interested in the environment and safety of it.",105,"climate","social"
"self","s368","comment","3","The article is about weight loss based on diet quality.",8,"health","control"
"self","s371","comment","3","The benefit of exercising seems to be directly related to the length of life.",16,"health","control"
"social","s372","comment","3","A Tibetan glacier once again collapsed again after it did in 2016, puzzling scientists and causing them to reconsider their research.",45,"climate","control"
"self","s373","comment","3","Using wind energy could be useful in the future.",1,"climate","self"
"self","s375","comment","3","I love Science in general and the Headlines seems to imply that the Auto Industry are serious about Climate Change. I also want to read what Sylvia Earle has to saw during the conversation/interview. Plankton is vital to the Earths Oxygen Levels and the Oceans Ecosystem.",71,"climate","self"
"social","s380","comment","3","Because of a disease, a person had to give up food that would otherwise be healthy for them.",26,"health","control"
"social","s386","comment","3","it matters to a lot people especially people that is battling breast cancer it can help with their situation",104,"health","social"
"self","s387","comment","3","climate change leading to more bigger problems",99,"climate","control"
"social","s390","comment","3","they will provide the two big climate meeting that is used the food waste.",11,"climate","social"
"self","s394","comment","3","effects of global warming",15,"climate","control"
"social","s395","comment","3","This article is about to switch a Green Energy Provider",83,"climate","control"
"social","s396","comment","3","Treat eating disorders to help.",96,"health","control"
"social","s399","comment","3","A floating trash zone is much larger than originally believed and is growing at an exponential rate.",79,"climate","control"
"social","s400","comment","3","Can statins use increase skin infection?",80,"health","control"
"self","s401","comment","3","Of course even myself felt that the walking depends on the person with whom we are walking",36,"health","self"
"self","s402","comment","3","It's about how the world has been changed because of people keeps to work and stay at home",33,"climate","control"
"social","s403","comment","3","multiple aspects lead to you being immune or not to the flu/cold",100,"health","social"
"social","s406","comment","3","It is about how eating more meat leads to higher chances of breast cancer in the study/studies they are citing.",52,"health","control"
"self","s411","comment","3","now a condition most of the people were effected in diabetes and it is very dangerous disease effects on energy regulation hormones at normal human consumption levels",4,"health","self"
"self","s412","comment","3","the article give information about  california and new york have sued oil and gas giants",105,"climate","control"
"self","s414","comment","3","The article is suggesting readers to help the Earth by consuming less but also is trying to educate about government shutdown and climate change.",31,"climate","control"
"self","s415","comment","3","this is strange. all strive for records",62,"health","self"
"self","s418","comment","3","This matters to me personally because I need to know what G.M.Os are and I should study them.",102,"health","self"
"self","s419","comment","3","earth had its hottest june this year",91,"climate","control"
"social","s420","comment","3","It makes a great issue of climate change. Burning coal will make a risk to future.",43,"climate","control"
"self","s421","comment","3","Working out and doing cardio like cycling professionals do probably does keep you biologically younger.",18,"health","control"
"self","s422","comment","3","A carbon emissions proposal failed due to the objections of countries that are heavily dependent on coal.",41,"climate","control"
"social","s423","comment","3","We all need to get on board with solutions for clean energy.",1,"climate","social"
"self","s425","comment","3","This article describes how to cope with a drought with respect to the potential for fires.",17,"climate","control"
"self","s432","comment","3","This article is about climate change and how scientists are trying to expose a fabricated blog about polar bears.",77,"climate","control"
"self","s434","comment","3","Deli meats is produced to the cancer .",28,"health","control"
"social","s435","comment","3","The differences experiences throught the lossing weight process due to  individual biological differences.",78,"health","control"
"social","s436","comment","3","Shift gears are necessary things on climate change.",71,"climate","control"
"self","s437","comment","3","health is wealth so low calorie food like eat maintain our body level",108,"health","self"
"self","s439","comment","3","This unfortunately is a sad view into a society, that cares more about themselves than other people living on this planet.",103,"climate","self"
"social","s442","comment","3","babies should only be fed breastmilk until 6 months under current guidelines.",44,"health","social"
"self","s444","comment","3","This article matters to me personally because of the champions coal that won in national elections",21,"climate","self"
"self","s445","comment","3","conservation bill makes the statement",19,"climate","control"
"self","s446","comment","3","Being overweight can lead to cancer.",54,"health","control"
"social","s448","comment","3","This article is about a study which suggests a correlation between physical fitness and reduced rates of Dementia, in middle aged women.",34,"health","control"
"self","s449","comment","3","This article describes the risk of statins.",80,"health","control"
"self","s450","comment","3","I do tend to eat deli meats at least weekly, so it is slightly relevant.",28,"health","self"
"social","s453","comment","3","this is health issues details so this article matters to people you know.",50,"health","social"
"social","s454","comment","3","Skipping breakfast as weight loss strategy.",0,"health","control"
"self","s456","comment","3","Special treatment for obesity",74,"health","control"
"self","s457","comment","3","The US blocked the Artic Council's ability to issue a joint declaration regarding climate change.",35,"climate","control"
"social","s460","comment","3","My father and others I know are avid skiing fans so the preservation of snow would interest them greatly.",5,"climate","social"
"social","s462","comment","3","Everyone wants cleaner air, right?",107,"climate","social"
"social","s463","comment","3","this would encourage them to use other reuseable bags",55,"climate","social"
"social","s466","comment","3","It matters to people I know because these storms can damage their homes or kill them.",15,"climate","social"
"social","s467","comment","3","Electric cars are helpful for global to reduce the global warming.",73,"climate","social"
"social","s470","comment","3","Most of the people i know recycle so it would matter to them to know where its going and if it is really being recycled.",49,"climate","social"
"self","s471","comment","3","An article about climate change causing more avalanches that are bigger and what to expect in the future.",45,"climate","control"
"social","s473","comment","3","it's about diet for people with a high in gluten",66,"health","control"
"self","s475","comment","3","laws to reduce climate change were voted on in the election",75,"climate","control"
"self","s478","comment","3","There are more diseases spreading across. But there is not much information about it and how to cure it.",88,"health","control"
"social","s479","comment","3","That since 1950 we had generate 8 billion tons of plastic that has been impactful to our environment",67,"climate","control"
"self","s481","comment","3","If kids play it helps the US save money, presumably because of health benefits of activity",12,"health","control"
"self","s482","comment","3","This article is about how you can do brief sets of exercises targeting different areas of your body so that you can get into shape and gain muscle tone with short, 13-minute exercise sessions.",48,"health","control"
"self","s483","comment","3","As a husband of a woman with an eating disorder, all I want to do is help! I just wish I knew how",96,"health","self"
"social","s485","comment","3","Express weight training",48,"health","control"
"self","s487","comment","3","It feels me better understanding",57,"climate","self"
"social","s488","comment","3","fuel efficiency rules for automobiles pushed back by lobbies",29,"climate","control"
"self","s490","comment","3","Coal is a dirty fuel and should be used less.",43,"climate","self"
"social","s492","comment","3","Exercise such as cycling is proven to keep us younger and healthier longer.",18,"health","control"
"self","s493","comment","3","Moving around is good for the brain and your age",14,"health","control"
"social","s494","comment","3","This article about hearing loss message...this activity is serious injuries",90,"health","social"
"social","s495","comment","3","This article matters to older family members of mine who have strong sweet-tooths and are also diabetic and over the age of 60",4,"health","social"
"self","s496","comment","3","to prevent the plants , its god's gift",22,"health","self"
"social","s497","comment","3","This is a summary (or a highlight, or a title) of an article about climate change and perhaps automakers and their expectations.",71,"climate","control"
"social","s498","comment","3","A school program where children exercise before the day begins -- and hour of running and different games -- has results that indicate that participants are happier and more energetic throughout the day.",86,"health","control"
"self","s499","comment","3","climate change is natural one ,we must make a pre-safety method for our protection",27,"climate","control"
"social","s502","comment","3","This article is about sugar drinks and the health risks and negative effects on our bodies.",4,"health","control"
"self","s504","comment","3","This article is about how a heart monitor can make High-intensity interval training fun and easier for people to do.",58,"health","control"
"social","s505","comment","3","The article busted the myths about antioxidants that said will ease muscle soreness after exercise.",40,"health","control"
"social","s506","comment","3","A rare animal called the vaquita died because they were trying to capture and rehabilitate it so now there are only 30 left.",101,"climate","control"
"self","s507","comment","3","its a danger to the ecosystem and natural rescources",79,"climate","self"
"self","s512","comment","3","I work out and sometimes do these type of exercises",58,"health","self"
"social","s513","comment","3","This article explains how the election results will influence the future of a variety of climate change initiatives",75,"climate","control"
"self","s514","comment","3","Good to know so I don't waste effort on this!",40,"health","control"
"self","s515","comment","3","Downside to going Gluten-free should be a disciplined by oneself.",66,"health","self"
"social","s516","comment","3","as i said before climate change is to learn by everybody and particularly about global warming",95,"climate","social"
"social","s517","comment","3","It contains more information to me",5,"climate","social"
"self","s520","comment","3","This article matters to me because all lives matter, even animals. Weakening the law will kill off species that are endangered!",89,"climate","self"
"self","s522","comment","3","Because I love to cook and to know what I'm putting into my body.",42,"health","self"
"self","s526","comment","3","Traveling less to save energy overall.",33,"climate","control"
"self","s527","comment","3","I care about the wildlife in Fl even if I live in NJ",39,"climate","self"
"social","s529","comment","3","Study suggests that a common gut bacterium may help obese people with metabolic disorders.",74,"health","social"
"self","s530","comment","3","meat is dangerous for health",50,"health","self"
"social","s531","comment","3","Because this applies to most of us living in the midwest.",54,"health","social"
