"cond","SID","survey_name","item","value","article_number","content","article_cond"
"self","s446","comment","5","Having a heart monitor can make your high intensity training fun.",58,"health","control"
"social","s448","comment","5","The article suggests that there is some evidence that eating fish makes children smarter, and it seems to be advising pregnant women and parents to incorporate more fish into their, and their family's, diet.",30,"health","control"
"self","s449","comment","5","This article describes the discussions at the TECH Conference in San Francisco.",81,"climate","control"
"self","s450","comment","5","Celebrity Chef Tom Colicchio talks about farmers market shopping.",20,"health","control"
"social","s453","comment","5","this article is about fitness our body",56,"health","control"
"social","s454","comment","5","Too many sugary drinks cause cavities and diabetes. Premature death from this is stupid.",4,"health","control"
"self","s456","comment","5","This article tells about important of exercise",76,"health","self"
"self","s457","comment","5","This article is about how Egyptian leaders in the past tried to fight climate change by using their resources.",37,"climate","control"
"social","s460","comment","5","People I know are very concerned about the short and long-term dangers of climate change and the protection of the environment matters to them.",1,"climate","social"
"social","s462","comment","5","This affects everyone, so I recommend checking this out.",109,"climate","social"
"social","s463","comment","5","this would raise awarness about being overweight",54,"health","control"
"social","s466","comment","5","If you are in good physical shape, it may be healthy like not smoking.",16,"health","control"
"social","s467","comment","5","Effect of the climate change Polar Bears are affect more.",77,"climate","social"
"social","s470","comment","5","about antioxidants not helping alleviate post exercise muscle aches",40,"health","control"
"self","s471","comment","5","This article is about how one very rich person could get 3 countries to continue burning coal for years even though it has future risks.",43,"climate","control"
"social","s473","comment","5","race give a reason  to  have something  new",62,"health","social"
"self","s475","comment","5","I am really big on budgeting",70,"health","self"
"self","s478","comment","5","This article matters to me personally as am afraid that the climate change would cause more trouble to the companies growth and working people job.",87,"climate","self"
"social","s479","comment","5","We need to shine light on this as many people encroached their grass and it can cause wildfires which has hurt us recently",63,"climate","social"
"self","s481","comment","5","It's about the senate passing new legislation about conservation",19,"climate","control"
"self","s482","comment","5","Paper and plastic which gets exported to China for recycling is sometimes not getting recycled but instead is being dumped into landfills; thus when you recycle materials they may not be getting recycled at all.",49,"climate","control"
"self","s483","comment","5","When you lose one of your key senses, the sense of hearing, it leaves you vulnerable to physical injury dur to accidents",90,"health","control"
"social","s485","comment","5","Babies who get solid food at 3 months sleep better",44,"health","social"
"self","s487","comment","5","It personally affects me",58,"health","self"
"social","s488","comment","5","how bad is to eat deli meat",28,"health","control"
"self","s490","comment","5","This article suggests ways to improve sleep of babies.",44,"health","control"
"social","s492","comment","5","I think this is just common sense advice and it's why a lot of my friends try to do at least some type of exercise.  My husband is a fiend for exercising and in the ten years we've been together, he's never needed to see a doctor for anything.",16,"health","social"
"self","s493","comment","5","Exercise is good for children, and it could save the US 120 billion a year",12,"health","self"
"social","s494","comment","5","This message relevant to people...very worried about content",93,"climate","social"
"social","s495","comment","5","This matter because cost will go up significantly hurting the economy",9,"climate","social"
"self","s496","comment","5","healthiest one in meal these are",26,"health","self"
"social","s497","comment","5","I think this article is about a person describing their grandmother's delight in fast food and how cheap it is.",70,"health","control"
"social","s498","comment","5","Obesity, high blood pressure, high blood sugar, high cholesterol, and whatever a triglyceride is could lead to people developing Parkinson's at a greater rate.  More dangers of obesity and poor diet, I imagine.",82,"health","control"
"self","s499","comment","5","oil industry now face a new restriction , it affects their business",29,"climate","control"
"social","s502","comment","5","This article is important for current events. It's information people need to know and that matters. The economy and the environment, issues that must interest us all.",9,"climate","social"
"self","s504","comment","5","This article matters to me personally because I am very interested in increasing my exercise and trying to be more healthy in the upcoming year. I intend to push myself more than I ever have, so this directly relates to my life.",56,"health","self"
"social","s505","comment","5","The article suggested environmentally friendly products that my environmentally conscious friends might find useful and relevant.",47,"climate","social"
"social","s506","comment","5","AI is being used to search out and prevent or predict breast cancer for better treatment. This matters to people I know because I have friends and family who have struggled with breast cancer and their children and relatives could benefit from this new technology.",104,"health","social"
"self","s507","comment","5","we have the technology to do so much better than burn gas.",71,"climate","self"
"self","s512","comment","5","The benefits of exercising",56,"health","control"
"social","s513","comment","5","People who exercise and don't lose weight are most likely eating more without realizing it",78,"health","control"
"self","s514","comment","5","Kidney stones are so painful good to know how to prevent them.",46,"health","self"
"self","s515","comment","5","Taking Vitamin D may help pregnant woman.",60,"health","control"
"social","s516","comment","5","people need to know about solar energy and it is knowledgeable thing to know",93,"climate","social"
"social","s517","comment","5","It affects me exercise alone",6,"health","social"
"self","s520","comment","5","The article is about how dieting, smoking cessation, exercising and managing stress can help remove plaques in arteries to reduce the chance of heart attacks.",84,"health","control"
"self","s522","comment","5","It's about a wealthy industrialist who kept the world burning coal longer than anyone anticipated.",43,"climate","control"
"self","s526","comment","5","Because I have a relative with dementia, it is very important to me to prevent this.",34,"health","self"
"self","s527","comment","5","Eating fish might make me encourage others like kids and women who are pregnant to stay healthy.",30,"health","self"
"social","s529","comment","5","Senator Schumer's climate plan would give vouchers so consumers could buy electric vehicles.",73,"climate","control"
"self","s530","comment","5","plastic usage is dange one",55,"climate","self"
"social","s531","comment","5","We knew there was a benefit to getting up early and doing what we do!",56,"health","social"
"self","s532","comment","5","I believe that is important based on what we feel like is important to our health and our mental welfare.",34,"health","self"
"social","s533","comment","5","this could help out people recover better who I know that work out regularly",68,"health","social"
"self","s535","comment","5","This article is about the paradoxical nature of obesity and its effects on health and mortality.",108,"health","control"
"self","s537","comment","5","It makes me feel like our studies and results are keeping us indecisive on what is going on with climate change.",35,"climate","self"
"self","s538","comment","5","I have three school-aged children who could benefit greatly from such a program.",86,"health","self"
"social","s540","comment","5","This matters to people i know because climate change is going to be something that effects us and our kids.",13,"climate","social"
"social","s541","comment","5","If you  want your baby to sleep better, giving them solid food at 3 months will help.",44,"health","control"
"self","s543","comment","5","It's nice to know the people of earths history and how we came to be",37,"climate","self"
"self","s544","comment","5","My society was not clean. So this article matters me personally.",107,"climate","self"
"social","s545","comment","5","Hard of hearing? It could cause you more accidents.",90,"health","social"
"social","s546","comment","5","Some people I know still don't recycle.",55,"climate","social"
"social","s547","comment","5","It matters to people I know because it would give them a reason to stay active.",34,"health","social"
"social","s548","comment","5","Peoples are must knows how to proposed to remove protections for species.",89,"climate","social"
"social","s551","comment","5","excelent option this is the best form to prevent illness",86,"health","social"
"social","s552","comment","5","This is something that is extremely bad for our environment. Coal is known to be something that affects our climate in a bad way and people should be concerned.",21,"climate","social"
"social","s553","comment","5","Science is rethinking a healthy weight and diet.",8,"health","control"
"social","s554","comment","5","May be the people who hate these food items want to see,how much the nutrients does the spinach has.",42,"health","social"
"self","s555","comment","5","it is about to save earth",31,"climate","control"
"social","s558","comment","5","Climate change is going to have a large impact on society.",7,"climate","social"
"social","s559","comment","5","it is about some disorder",96,"health","control"
"self","s561","comment","5","I am ambivelent towards climate change and its causes. A global stike will prove nothing.",27,"climate","self"
"social","s563","comment","5","There's always a debate about which is worse, filling the landfills with plastic, or cutting down trees to make paper bags.  This might help answer those issues for you.",57,"climate","social"
"social","s567","comment","5","A lot of the people that I know live in the south or midwest.",54,"health","social"
"self","s568","comment","5","Its an introduction and impact of some snake oil which researchers were thinking about.",88,"health","control"
"social","s570","comment","5","This article is about having my own wind turbine.",1,"climate","control"
"social","s571","comment","5","My parents have a home in Florida that is on the water and whenever I hear news about climate change based flooding I get a little nervous.",25,"climate","social"
"self","s572","comment","5","This topic strikes my interest in several ways, what most makes it important is the curiosity I have about the studies being used to conduct these tests. A gut bacteria supplement sounds both interesting and scary because the example used was mice running faster. This would peak my interest to learn more about the supplement itself and how the study on mice was conducted.",72,"health","self"
"social","s574","comment","5","This article would be relevant to people I know because they are of older the Aging population and this might be a way for them to improve their cognition.",14,"health","social"
"social","s575","comment","5","Most people I know are against this.",61,"climate","social"
"self","s576","comment","5","A lot of people I know drive SUVs and the climate affects me and the world.",103,"climate","self"
"self","s577","comment","5","People who think they know the most about gmo's know the least about them it has been shown.",102,"health","control"
"social","s578","comment","5","Global warming is causing weather patterns to become more erratic and dangerous. Despite this, evacuation of people in dangerous areas affected by storms is improving.",15,"climate","control"
"social","s581","comment","5","Nowadays, young adults are aware about climate change. It is a good one.",27,"climate","social"
"social","s582","comment","5","My Mom and I walk really fast, so it's curious to know why we all walk at different speeds",36,"health","social"
"self","s583","comment","5","nature of women and child having interest to eat fish and make them smarter.",30,"health","control"
"self","s584","comment","5","Climate change could wreak much more havoc if something isn't done soon.",97,"climate","self"
"self","s587","comment","5","Breakfast is the grossest meal anyway.",0,"health","self"
"self","s588","comment","5","This article is about climate change and politics.",75,"climate","control"
"self","s589","comment","5","Being overweight can cause long term problems.",108,"health","control"
"social","s592","comment","5","So bad health creates health problems, shocking.",82,"health","social"
"social","s593","comment","5","It is about Climate change and research how the polar bears affecting by the climate change.",77,"climate","control"
"social","s594","comment","5","The article is to make awareness for the people to save food.",20,"health","social"
"self","s595","comment","5","Climate change and the failure of European Union to respond to it.",41,"climate","control"
"social","s598","comment","5","This article matters to people I know because it informs them of common factors in their lives that increase their risk of developing Parkinson's disease.",82,"health","social"
"social","s599","comment","5","exercise is good for health and and aged peoples also look like young when we do exercise",18,"health","control"
"self","s600","comment","5","I grew up on unhealthy eating habits",92,"health","self"
"social","s602","comment","5","bananas are delicious and sports drinks are expensive",68,"health","social"
"social","s606","comment","5","This article is most useful to pregnant women.",30,"health","social"
"self","s608","comment","5","pertains to overall strategies for optimal health",6,"health","self"
"social","s610","comment","5","Flood control is an important step to take by the government to save lives of people",25,"climate","social"
"social","s613","comment","5","Energy companies are trying to change certain laws regarding fuel efficiecy rules.",29,"climate","control"
"self","s615","comment","5","issue about climate change of our country",35,"climate","control"
"self","s616","comment","5","The peoples are no smoking because this is nod good for in life.",16,"health","control"
"social","s618","comment","5","People will get vouchers to help purchase cars with a new government proposal.",73,"climate","control"
"self","s619","comment","5","Genetically Modified Organisms",102,"health","control"
"self","s620","comment","5","It potentially has information that would be useful for my toddler as they continue to grow.",86,"health","self"
"self","s621","comment","5","This will help me reduce my carbon footprint.",57,"climate","self"
"self","s622","comment","5","Americans plastics and papers are been dumped in landfills cause china stopped recycling most foreign garbage",49,"climate","control"
"social","s623","comment","5","Challenge is must in the sports",62,"health","social"
"self","s624","comment","5","I exercise so I am so happy that it is so good for you.",16,"health","self"
"social","s626","comment","5","The article matters to people because it tell about Recycling in correct way.",69,"climate","social"
"social","s627","comment","5","I know some old people",14,"health","social"
"self","s628","comment","5","This article is very important to me.Because I always use reusable products",47,"climate","self"
"self","s629","comment","5","This is a very useful information.",22,"health","self"
"self","s630","comment","5","The article is about discussion ranged in the conference",81,"climate","control"
"social","s631","comment","5","By the end of this century? Good to know we'll all be gone. What's left of the world can fend for itself.",99,"climate","social"
"social","s634","comment","5","People should be informed of healthy choices.",32,"health","social"
"self","s635","comment","5","This is going to cause more emissions being released into the air I am breathing.",29,"climate","self"
"self","s636","comment","5","They are going to drill for oil in an Arctic Wildlife Refuge!",61,"climate","control"
"self","s638","comment","5","This article deals with  giving permission to take  oil and gas exploration in Artic Wild life region.",61,"climate","control"
"social","s639","comment","5","Scientists have not found much proof about the benefits of CBD.",88,"health","control"
"self","s640","comment","5","I personally have the analyzing the pressure of the bones...",98,"health","self"
"self","s001","comment","6","A skier trying to save snow and a scientist who won a prize for mapping peat.",5,"climate","control"
"self","s002","comment","6","Diabeties and those who are in diets can follow  gluten free",66,"health","control"
"social","s003","comment","6","A breakdown of the elections and how the votes involving Climate Change went.",75,"climate","control"
"social","s004","comment","6","This is helping to prevent expansion and exploitation of greedy energy companies from polluting and destroying these lands.",19,"climate","social"
"social","s005","comment","6","5 Takeaways from Climate TECH recent conference. Took place in San Francisco. Topics include, new technology, big data, lab grown meat, new governor candidate and more.",81,"climate","control"
"social","s008","comment","6","Going green is not only helps the environment it also helps save money so I want people to know",83,"climate","social"
"self","s009","comment","6","Potential risks of gluten-free diet on healthy individuals",66,"health","control"
"social","s010","comment","6","it warns of a possible health issue they can take steps to reduce the risk of",82,"health","social"
"social","s012","comment","6","People who care about the environment should be concerned that SUV's are preferred cars.",103,"climate","social"
"self","s014","comment","6","Climate change is such a concern to me.",7,"climate","self"
"social","s015","comment","6","This is about staying healthy with a hectic schedule.  Using only 13 minutes of your time to exercise a day.",48,"health","control"
"social","s017","comment","6","Relevant authorities join hands to overturn the endangered species Act.",89,"climate","control"
"social","s018","comment","6","Research is indicating that low impact exercise may not be putting enough pressure on the bones causing harm to the bones.",98,"health","control"
"self","s019","comment","6","This article is about how how to tackle eating disorders when you are in a relationship.",96,"health","self"
"self","s020","comment","6","Plaques in arteries can be improved through various activities, which will in turn decrease the likelihood of heart attack.",84,"health","control"
"self","s021","comment","6","This article matters to me because I have nieces and nephews who I babysit, and would like for them to get as much rest as possible.",44,"health","self"
"social","s024","comment","6","A lot of my friends are car owners and this kind of thing directly affects them.",29,"climate","social"
"social","s025","comment","6","This article matters to people I know as they need to monitor their own health and to keep their weight within a reasonable limit in order to minimize health impacts.",108,"health","social"
"social","s028","comment","6","It is related to my known people as it is about perfumes",107,"climate","social"
"self","s030","comment","6","Some diseases like abdominal obesity, high triglycerides , high cholesterol may cause severe diseases like Parkinson disease , where most of the people have obesity and cholesterol problem  and so it matters me the most",82,"health","self"
"social","s031","comment","6","Reduction of carbon emissions.",41,"climate","social"
"self","s032","comment","6","This article explains the risk of colorectal cancer to those who consume many products that contain processed meat.",28,"health","control"
"self","s036","comment","6","Exercise can damage bones.",98,"health","control"
"social","s037","comment","6","Parkinson's disease related around us",82,"health","social"
"social","s038","comment","6","There are supposedly healthier proteins with plant based proteins than a majority of people who get it through meat and poultry.",64,"health","social"
"self","s040","comment","6","it is related to me because my gluten-free.",66,"health","control"
"social","s041","comment","6","This article is promoting a heart monitor for people who are afraid of getting a heart attack from High-intensity Interval Training.",58,"health","control"
"social","s042","comment","6","In all of the children who currently are sedentary started exercising every day, societies could save enormous amounts of money in the coming decades and have healthier citizens as a whole, according to a remarkable new study.",12,"health","control"
"self","s043","comment","6","The chicken little tactics must carry on.   Global warming is a myth, further study is needed.",11,"climate","self"
"social","s045","comment","6","because most people i know care about the climate and how to try to fix the issues that earth is having",71,"climate","social"
"self","s046","comment","6","training make body fit but doing the interval and make with heart monitor make more easy and fun
",58,"health","control"
"self","s048","comment","6","Explaining ways to avoid kidney stones.",46,"health","self"
"social","s049","comment","6","People I know want climate change to be more acknowledged by the general public.",95,"climate","social"
"self","s051","comment","6","The article will discuss the status of polar bears and how they have been affected by climate change.",77,"climate","self"
"self","s052","comment","6","This article is about two things....i.e. an olympic skier wants to save snow and Scientists win $1 million prize for mapping peat.",5,"climate","control"
"social","s053","comment","6","Low-impact sports might not put enough pressure on bones to help them.",98,"health","control"
"self","s054","comment","6","The effect of the climate change. It will come big issue on next five years.",87,"climate","control"
"social","s055","comment","6","This article could show that climate change and global warming is really happening.",91,"climate","social"
"self","s056","comment","6","Use less consumer products to get cleaner air.",107,"climate","control"
"self","s057","comment","6","I was in FL when this happened one time. The ocean had red blooms and a horrible smell. There were dead fish lying on  the beach. The wildlife is not only exposed to the alga but to the tons of trash dumped in the ocean that kill them. People need to wake up to what is happening!",39,"climate","control"
"self","s058","comment","6","We need to reduce coal use, our future depends on it.",21,"climate","self"
"social","s062","comment","6","Living in a coastal state, the matter discussed in this article is very important to myself, my friends and family. While the article seems more about the lucrative side, learning about how start-ups are coming across this information and how they are learning this could give readers insight into the risk of climate change.",59,"climate","social"
"self","s063","comment","6","Young people are taking part in a global strike regarding climate change.",27,"climate","control"
"self","s064","comment","6","fitness may be key to staving off dementia",34,"health","self"
"social","s065","comment","6","This article matters to people I know because I have a lot of people in my circle who are trying to get healthier and more fit.",78,"health","social"
"social","s066","comment","6","Save the snow....and peat",5,"climate","control"
"self","s067","comment","6","Multi-billion dollar companies whining about the fact that they have to only make 99 billion instead of 100 billion to save the planet.",87,"climate","control"
"social","s068","comment","6","People could lose their jobs over this, or take pay cuts.",87,"climate","social"
"self","s069","comment","6","This is about a study and how obesity may decrease your life span.",108,"health","control"
"self","s070","comment","6","Not surprising, a lot of oil flows into and out of Colorado.",105,"climate","self"
"social","s072","comment","6","This article matters to people I know because they are against wasting food and enjoy farmers markets.",20,"health","social"
"social","s073","comment","6","This matters because it explains how I and everyone I know are mostly powerless to do anything to make the world better.",43,"climate","social"
"social","s074","comment","6","Obesity is a big problem in the US and Mexico where I come from",108,"health","social"
"social","s075","comment","6","moving to the next level of tecnology",93,"climate","social"
"self","s076","comment","6","it makes me feel hopeful and positive about my health as I get older",14,"health","self"
"social","s078","comment","6","A Korean grandmother found a way to stretch her dollar at American fast food chains.",70,"health","control"
"social","s079","comment","6","driving suvs causes climate change",103,"climate","control"
"self","s080","comment","6","Our world is beginning to crumble around us and it feels like no one of importance wants to do anything to help.",45,"climate","self"
"social","s081","comment","6","It is an awful thing to see and hear about",79,"climate","social"
