"cond","SID","survey_name","item","value","article_number","content","article_cond"
"self","s318","comment","8","After one died during an attempted capture, scientists decided not to try and capture either of the other two remaining vaquita porpoises.",101,"climate","control"
"self","s319","comment","8","This article is about canadian zoologist",77,"climate","control"
"self","s320","comment","8","The people should known this fails",41,"climate","self"
"self","s321","comment","8","I have my children studying these program",86,"health","self"
"social","s322","comment","8","This article is about the potential negatives of using either plastic or paper bags at the grocery store and compares the two options.",57,"climate","control"
"self","s324","comment","8","They put climate change issues on the election ballots.",75,"climate","control"
"social","s326","comment","8","The climate change is the main part of natural disaster which we cannot stop. This article is about Hurricane Dorian and the other storms cause more damage to the nation so some Billions in recovery Funds were not spent for the disaster",13,"climate","control"
"social","s327","comment","8","about the environment impact by coal consuming",43,"climate","social"
"social","s328","comment","8","This article is about how doing more fitness activities can help people live longer lives",56,"health","control"
"social","s329","comment","8","This article is about a federal judge throwing out an Exxon Mobil lawsuit against attorneys general in New York.",3,"climate","control"
"self","s330","comment","8","The fossil fuel industry just can't seem to make enough money, and they couldn't care less what happens to our planet as they do it. Really sad.",29,"climate","self"
"self","s331","comment","8","Wastages should be recycled and should not pollute the water.",79,"climate","self"
"social","s335","comment","8","there is a dubious information going on about polar bears been circulated by Canadia zoolist blog",77,"climate","control"
"self","s337","comment","8","Chef Tom Colicchio suggests only buying produce you will use today when shopping at a farmer's market. This can help reduce food waste.",20,"health","control"
"social","s338","comment","8","On Friday, young adults and children skipped school to protest for climate change.",109,"climate","control"
"social","s344","comment","8","We should pay attention to our environment and know when to do the needful. Cut your invasive grasses while you can.",63,"climate","social"
"self","s345","comment","8","There is CBD all over and I would like to know if I should go ahead and try it or if I should wait for more research.",88,"health","self"
"social","s348","comment","8","It's about time we took climate change seriously",95,"climate","social"
"social","s349","comment","8","My dad doesn't like working out but maybe a heart monitor would make it more fun.",58,"health","social"
"social","s352","comment","8","The article matters to people I know because the article talks about the effect of plastic bags or paper",57,"climate","social"
"social","s353","comment","8","This article is about trust and unavoidable.",76,"health","control"
"self","s358","comment","8","Science made a big impact in scientists life",5,"climate","control"
"self","s360","comment","8","Algal is not serious problem in Florida in the past, but now it could be major problem and causes the problems for the coast. Also it made some problems in the future too.",39,"climate","self"
"social","s361","comment","8","My step-father had colorectal cancer and he eats a lot of deli meats, so this article would matter to myself and to my immediate loved ones.",28,"health","social"
"social","s363","comment","8","It matters to people I know, because they need to find new solutions to their exercise/diet problem.
Article is about new weight loss strategy involving skipping meal before morning work out.",0,"health","control"
"social","s364","comment","8","A condition called sleep apnea can effect your sleeping habits.",106,"health","control"
"self","s368","comment","8","The information on the danger of climate change is very important to me.",7,"climate","self"
"self","s371","comment","8","This article reports on recent meetings of climate scientists, as well as suggestions to reduce food waste during the holiday season.",11,"climate","control"
"social","s372","comment","8","All kinds of people can weight train successfully if you do an intense workout for 13 minutes which isn't too long if you count the time in a day.",48,"health","control"
"self","s373","comment","8","A skier wants to save the snow of the world.",5,"climate","control"
"self","s375","comment","8","Elderly persons tend to live on a Fixed Income and try to make their dollars stretch through frugality. Going from ""Riches to Rags"" sets a familiar and compelling backdrop to the story in the article. It will also contrast the Healthy Diet she had in Korea vs the Unhealthy Diet from Fast Food.",70,"health","self"
"social","s380","comment","8","We can all benefit for direct action to persuade policy makers to take climate change more seriously.",27,"climate","social"
"social","s386","comment","8","it is important to an animal lover because no one wants to see a mammal die",101,"climate","social"
"self","s387","comment","8","parents are force feeding their children",92,"health","self"
"social","s390","comment","8","under found side effect from dietary supplement",10,"health","social"
"self","s394","comment","8","very close to me the changes and more interesting",11,"climate","control"
"social","s395","comment","8","because this covers heritage sites threatened by climate change.",85,"climate","social"
"social","s396","comment","8","Climate change record heat wreaked havoc",97,"climate","control"
"social","s399","comment","8","Polar bears are a favorite of my children and we want to see them thriving.",77,"climate","social"
"social","s400","comment","8","About list of heritage sites that can be affected by climate change.",85,"climate","control"
"self","s401","comment","8","As a animal lover its is very personal that wildlife is getting affected by toxic tide and to make necessary action to prevent the wildlife",39,"climate","self"
"self","s402","comment","8","Our future also depends on our surroundings",36,"health","control"
"social","s403","comment","8","AI technology has breakthroughs with breast cancer research",104,"health","social"
"social","s406","comment","8","The article talks about how to stop your habit of using single-use items and how to get into more environmentally friendly habits.",55,"climate","control"
"self","s411","comment","8","global warming is big issue in our country it is create a pollution and effects in our economy lose percent of  coming years is very big issues and very important one",9,"climate","self"
"self","s412","comment","8","getically modified organism tend we know the least .the scientist new study found",102,"health","self"
"self","s414","comment","8","I am a huge advocate against study and this helps confirm why I did that.",32,"health","self"
"self","s415","comment","8","some good news, hav to keep in mind and pass it ovre",60,"health","self"
"self","s418","comment","8","It is about governments suing gas giants about Climate.",105,"climate","control"
"self","s419","comment","8","I think we need to be moving away from fossil fuels and this sounds like a good article explaining that",93,"climate","self"
"social","s420","comment","8","Avoid stone-farming foods like chocolate, spinach, tea, etc.., to prevent from kidney stone forming",46,"health","control"
"self","s421","comment","8","The argument is made that dance is actually the best form of exercise for brain health, even better than walking or stretching.",14,"health","control"
"self","s422","comment","8","There are more affordable and more effective methods for cleaning than single use products.",47,"climate","control"
"social","s423","comment","8","Climate change will decrease the GDP of the US.",9,"climate","control"
"self","s425","comment","8","Adverse effects from dietary supplements could impact my health and the health of my loved ones.",10,"health","self"
"self","s432","comment","8","This article is about a growing swath of trash that is floating in the ocean between California and Hawaii.  This mass of trash is predicted to be 16 times larger than originally thought.",79,"climate","control"
"self","s434","comment","8","Australia in a victory for coal , clears the way for a disputed mine.",21,"climate","control"
"social","s435","comment","8","A new use for bacteria derivated supplements related to address the obesity issue.",74,"health","control"
"social","s436","comment","8","A new study suggest very relevant to the California.",79,"climate","social"
"self","s437","comment","8","most of adults became obesity causes so take our routine life take excersise",106,"health","control"
"self","s439","comment","8","This matters to me, because overweight adults will read this, and think they don't need to lose weight. Proven, or not, obesity can cause a person harm in many different areas, including a healthy life.",108,"health","self"
"social","s442","comment","8","recycling process must be followed to reduce the pollution. It must be followed by all the peoples who were in the us. It is beneficial process.",49,"climate","control"
"self","s444","comment","8","This article matters to me because it helps me to know the importance of flavonoids in plants.",22,"health","self"
"self","s445","comment","8","in childhood days good and precious day for us",12,"health","control"
"self","s446","comment","8","Ways to benefit from intense exercise.",56,"health","control"
"social","s448","comment","8","The article talks about what people can do to help improve the earth, in the coming year. It also discusses a government shutdown and presents a Democratic plan to help address climate change.",31,"climate","control"
"self","s449","comment","8","This article describes the claims of a snake oil.",88,"health","control"
"self","s450","comment","8","I actually live close to flood-prone areas so this affects my neighborhood, so to speak.",23,"climate","self"
"social","s453","comment","8","this is very useful things to avoid plastics",55,"climate","social"
"social","s454","comment","8","Wildfires are caused by global warming.",7,"climate","social"
"self","s456","comment","8","Effect of climate change in polar bears life",77,"climate","control"
"self","s457","comment","8","I have a dog myself and we let him sleep in the bed. I think it's good to know that it is helping both mine and my dog's sleep patterns.",38,"health","self"
"social","s460","comment","8","This article is about the many dangers of sugar and sugary drinks.",4,"health","control"
"social","s462","comment","8","Sleep apnea consequences, and the main cause behind it.",106,"health","control"
"social","s463","comment","8","this will raise awareness about climate change",59,"climate","control"
"social","s466","comment","8","There is a bill that is passing to have federal funds for conservation",19,"climate","control"
"social","s467","comment","8","We are more addicted to fast food. Fast food not help to reduce weight.",78,"health","control"
"social","s470","comment","8","because we use coal as an energy source.",43,"climate","social"
"self","s471","comment","8","This is about babies eating solid foods when they reach 3 months old and how that may help them to sleep longer at night.",44,"health","control"
"social","s473","comment","8","vitamin d is great in pregnancy for the baby growth",60,"health","control"
"self","s475","comment","8","Sanator shumer has a plan to give people vouchers for electric cars
",73,"climate","control"
"self","s478","comment","8","This article is about the risk of Parkinson's disease which is increased by the abdominal obesity and other issues like high blood pressure and diabetes.",82,"health","control"
"social","s479","comment","8","new races that are designed to guarantee you wont set a new record are on the up and coming for runners",62,"health","control"
"self","s481","comment","8","Government aid has not helped Americans hit by storms",13,"climate","control"
"self","s482","comment","8","Large glacier collapses (larger than previously expected) are starting to happen more frequently due to climate change, and it's likely this will continue in the future.",45,"climate","control"
"self","s483","comment","8","Climate change has us on track toward multiple disaster movie -level crises in the not-too-distant future",99,"climate","control"
"social","s485","comment","8","Finding alternative disposable cleaning products could help people I know.",47,"climate","social"
"self","s487","comment","8","It understands me better",55,"climate","self"
"social","s488","comment","8","because climate change is real and we need this planet to live . this is a topic that matters to everyone",27,"climate","social"
"self","s490","comment","8","This article is about how cooking can effect levels of nutrients",42,"health","control"
"social","s492","comment","8","After years of working on it, a new land conservation bill has finally been passed.  It designates millions of acres for environmental protection and sets up a federal program to help pay for conservation.",19,"climate","control"
"self","s493","comment","8","It’s people who are trying to lose weight but not the healthy way. Using pills and dangerously risking their life’s",10,"health","self"
"social","s494","comment","8","This article about relevant to people...worried about the message",91,"climate","social"
"social","s495","comment","8","Exxon's attempt to block an investigation was cut down by a NY federal judge",3,"climate","control"
"self","s496","comment","8","the best advice to known for",20,"health","control"
"social","s497","comment","8","I think this article matters to people I know because it could bring some hope as some are trying to lose weight and be healthy.",72,"health","social"
"social","s498","comment","8","Within the next five years, climate change could have severe economic impacts on major corporations.  They're estimating almost a trillion dollars in risks.  So much for that 401k.",87,"climate","social"
"self","s499","comment","8","seeds and gout  had been eating more years ago it is good for health",26,"health","control"
"social","s502","comment","8","It matters to people I know because the article provides weight loss tips and strategies that can come in handy. I know many people who struggle with weight loss and this article could really help them.",0,"health","social"
"self","s504","comment","8","This article is about how environmentalists and nuclear power is trying to come together, however they are facing issues that complicate the situation. It also talks about how people can reduce their own carbon footprints.",51,"climate","control"
"social","s505","comment","8","This article creates awareness about climate change issues.",41,"climate","social"
"social","s506","comment","8","My partner has sleep apnea and we talk about it every now and then because I am worried about this a great deal. This matters because it could be life or death for him if he doesn't lose weight.",106,"health","social"
"self","s507","comment","8","about how there is more than just caloric input and output when it comes to weight loss",78,"health","control"
"self","s512","comment","8","Predicting the affects of climate change",59,"climate","control"
"social","s513","comment","8","I know plenty of people who care about polar bears and our climate in general and we need to verify the accuracy of information being shared.",77,"climate","social"
"self","s514","comment","8","This concerns me as we are running out of time to reduce carbon emissions, this affects us all!",41,"climate","self"
"self","s515","comment","8","Organic product are more helpful to the body than inorganic product.",64,"health","control"
"social","s516","comment","8","To people know the hearing loss impact on future",90,"health","social"
"social","s517","comment","8","It gives me more information",8,"health","social"
"self","s520","comment","8","This article matters by providing awareness of climate week and a call for action where appropriate.",83,"climate","self"
"self","s522","comment","8","E.U. Leaders foiled in climate target attempt by developing Eastern countries who oppose.",41,"climate","control"
"self","s526","comment","8","Climate change should matter to everyone personally, it is very important.",35,"climate","self"
"self","s527","comment","8","We are saving energy by staying home more for the most part",33,"climate","control"
"social","s529","comment","8","It's unclear whether a gut bacteria that makes mice run faster would work on humans.",72,"health","control"
"self","s530","comment","8","REDUCE OWN CARBOB FOOTPRINT",51,"climate","control"
"social","s531","comment","8","The un-natural partnership of nuclear power an environmentalists.",51,"climate","control"
"self","s532","comment","8","I believe our wildlife are extremely important to our survival and i care about all the creatures.",39,"climate","self"
"social","s533","comment","8","there may be no reason to go gluten free if you are not highly sensitive to gluten",66,"health","control"
"self","s535","comment","8","This article is about young people protesting inaction on environmental protection policies.",109,"climate","control"
"self","s537","comment","8","I truly relate to this one.  When my dogs are sleeping in the same room with me, I am at more comfort and sleep better.  With how the act,  I am sure they feel the same way.",38,"health","self"
"self","s538","comment","8","Despite my best efforts, I suffer from obesity and high blood pressure and would be concerned for my future health.",82,"health","self"
"social","s540","comment","8","This article has to do with a bill that is saving acres of wilderness for the environment.",19,"climate","control"
"social","s541","comment","8","This matters because people i know care about the climate and want to help the earth.",41,"climate","social"
"self","s543","comment","8","I have a dog and am a current pet owner. Would be nice to know this research data.",38,"health","self"
"self","s544","comment","8","It is about the oil and gas giants",105,"climate","control"
"social","s545","comment","8","Farmers, like my family, are having problems with their crops due to increased temperatures.",91,"climate","social"
"social","s546","comment","8","The options of plastic or paper and the downsides of each.",57,"climate","control"
"social","s547","comment","8","This article is about a study that suggests people traveling less is saving on energy usage.",33,"climate","control"
"social","s548","comment","8","Peoples are must know about the climate-related risks.",87,"climate","control"
"social","s551","comment","8","i think the politicians needs to be more participative in the climate change",81,"climate","social"
"social","s552","comment","8","The article is about when certain foods for vegans start to affect their stomach badly",26,"health","control"
"social","s553","comment","8","Your children need to learn better eating habits.  Here’s how.",2,"health","social"
"social","s554","comment","8","The food that we should avoid inorder to prvent from kidney stone.",46,"health","control"
"self","s555","comment","8","it is about climatic change",35,"climate","control"
"social","s558","comment","8","Court blocks Exxon's attempt to stop the investigation into the company's role in climate change.",3,"climate","control"
"social","s559","comment","8","because it is very crucials",95,"climate","social"
"self","s561","comment","8","Australia is still producing coal.",21,"climate","control"
"social","s563","comment","8","There is new science that suggest adding intensity to your workout, pushing yourself to do more, creates benefit in the cells that translate to longer life.",56,"health","control"
"social","s567","comment","8","People I know are into fitness",58,"health","social"
"self","s568","comment","8","Lifestyle makes a tremendous changes in all life of people, we have to take care of our health and should stay healthy.",84,"health","self"
"social","s570","comment","8","This article is about a court dismissing an exxon lawsuit.",3,"climate","control"
"social","s571","comment","8","Cancer runs in my family and anything that helps reduce the risk is a positive in my book. Most of us don't have the best diet to begin with and so adding more plants that have flavonoids is likely going to be better for everyone.",22,"health","social"
"self","s572","comment","8","This article raises my awareness on how eating more impacts our weight gain, regardless of exercising. It mentions how a few more bites throughout the day can result in weight gain and I suffer from this daily and it really strikes home for me. This topic is of personal importance to me and many around me.",78,"health","self"
"social","s574","comment","8","Disaster funds are very slow to reach the people who need them and the problem is not going away most likely because of climate change.",13,"climate","control"
"social","s575","comment","8","It is about Greta, a girl climate activist from Sweden, and hardships she has had.",65,"climate","control"
"self","s576","comment","8","Climate change affects my life and it's good to see young people take a stand on it.",109,"climate","self"
"self","s577","comment","8","Products like perfume, deodorant ,pesticides and paint contribute as much as cars to pollution.",107,"climate","control"
"social","s578","comment","8","This article matters to me and people I know because I love exercising and many of my friends do as well, so it is good to know that exercise is able to keep our immune systems healthy and our bodies biologically younger.",18,"health","social"
"social","s581","comment","8","People make the good decision.",21,"climate","control"
"social","s582","comment","8","Maybe we can learn, as people, to do better things to help Climate Change based on what they did",37,"climate","social"
"self","s583","comment","8","it`s a bad news we have a responsibility to take some action against climate change",35,"climate","self"
"self","s584","comment","8","Sports that put too little pressure on your bones could be putting people at risk of health issues.",98,"health","control"
"self","s587","comment","8","Healthy eating ideas for kiddos",2,"health","control"
"self","s588","comment","8","This article is about saving money when getting fast food.",70,"health","control"
"self","s589","comment","8","it may have insight as to why I dont get sick as often as others I know",100,"health","self"
"social","s592","comment","8","Lab grown meat could be a good change but fear driven responses to change are often detrimental.",81,"climate","social"
"social","s593","comment","8","People should avoid certain things like said above in the headlines to avoid climate change. We never encourage like those things.",75,"climate","social"
"social","s594","comment","8","The article gives more information about the flood and its complications.",25,"climate","social"
"self","s595","comment","8","Building of strength through simple light exercise",48,"health","control"
"social","s598","comment","8","This article matters to people I know  because climate change affects everyone.",87,"climate","social"
"social","s599","comment","8","DON'T WASTE FOOD FOR EVER IN HOLIDAYS. REDUCING IS ONE OF THE BEST OPTION DON'T  TRY NEW METHODS",11,"climate","social"
"self","s600","comment","8","I am health conscous",98,"health","self"
"social","s602","comment","8","It is about racing for fun instead of just setting records",62,"health","control"
"social","s606","comment","8","Because is killing florida wildlife.",39,"climate","social"
"self","s608","comment","8","pertains to guidelines for optimal health",8,"health","self"
"social","s610","comment","8","Eating processed meat leads to colorectal cancer",28,"health","control"
"social","s613","comment","8","This article does not matter to people I know, I do not know anyone from Australia.",21,"climate","social"
"self","s615","comment","8","fitness help us to fight over diseases",34,"health","control"
"self","s616","comment","8","children's playing games and exercising is always good for health.",12,"health","control"
"social","s618","comment","8","It's good to understand what makes a diet healthy, overall.",72,"health","social"
"self","s619","comment","8","I am very interested with this article so i felt very attached with this article.",105,"climate","self"
"self","s620","comment","8","Additional World Heritage sites are being threatened by climate change.",85,"climate","control"
"self","s621","comment","8","My wife, and other women in my life, would benefit from this information.",52,"health","self"
"self","s622","comment","8","the article is quite educative and informative",48,"health","self"
"social","s623","comment","8","This is in order to point out the need for recycling and the mistake that humans make when recycling",69,"climate","social"
"self","s624","comment","8","I like to move and I want to do all I can in order to keep my brain power.",14,"health","self"
"social","s626","comment","8","The article is about the girl who became climate activist.",65,"climate","control"
"social","s627","comment","8","Climate change is drastically and devastatingly affecting our lives",15,"climate","control"
"self","s628","comment","8","This article is about  how would we build strength.",48,"health","control"
"self","s629","comment","8","Mining is very useful for the economical growth of the nation.",21,"climate","control"
"self","s630","comment","8","it is about snake oil thatswhy it becomes a matter",88,"health","self"
"social","s631","comment","8","Not anything new, but it's nice to see a new study and some real before-and-after results.",94,"health","social"
